{
  "schema_version": "1.0",
  "engine": {
    "name": "security_engine",
    "version": "0.1.0"
  },
  "scan_id": "1d74ae78a7b645348a51e45dd41bf4b4",
  "scanned_at": "2026-10-30T14:21:04Z",
  "duration_sec": 5.05,
  "target": {
    "path": "C:/code/demo-site",
    "repo_url": null,
    "commit_sha": "3f9c2e1a7b4d5e6f8091a2b3c4d5e6f708192a3b"
  },
  "status": "complete",
  "coverage": {
    "osv": {
      "status": "ok",
      "state": "checked",
      "category": "dependency",
      "message": "",
      "version": "2.7.0",
      "count": 0,
      "duration_sec": 0.12
    },
    "semgrep": {
      "status": "ok",
      "state": "checked",
      "category": "code",
      "message": "",
      "version": "1.183.0",
      "count": 2,
      "duration_sec": 2.84
    },
    "gitleaks": {
      "status": "ok",
      "state": "checked",
      "category": "secret",
      "message": "",
      "version": "8.30.1",
      "count": 0,
      "duration_sec": 0.75
    }
  },
  "suppressions": [
    {
      "tool": "osv",
      "file": "osv-scanner.toml",
      "kind": "ignore_config",
      "detail": "GHSA-35jh-r3h4-6jhm"
    }
  ],
  "summary": {
    "open": 2,
    "by_severity": {
      "critical": 1,
      "high": 0,
      "medium": 1,
      "low": 0,
      "unknown": 0
    },
    "by_category": {
      "dependency": 0,
      "code": 2,
      "secret": 0
    },
    "by_status": {
      "code_issue": 2,
      "code_resolved": 2,
      "runtime_check_needed": 1,
      "out_of_scope": 0
    },
    "by_change": {
      "new": 1,
      "persisting": 1,
      "resolved": 3,
      "unverifiable": 0
    },
    "flagged": 1
  },
  "comparison": {
    "base_scan_id": "be06b7ea041b417f8f3ac08bbb156f68",
    "base_scanned_at": "2026-10-30T14:20:49Z",
    "base_commit_sha": "a1b2c3d4e5f60718293a4b5c6d7e8f9012345678",
    "new": 1,
    "persisting": 1,
    "resolved": 3,
    "unverifiable": 0
  },
  "dependency_upgrades": [],
  "findings": [
    {
      "fingerprint": "semgrep:ce71d69e207413ad554be5e0",
      "tool": "semgrep",
      "category": "code",
      "rule_id": "vibe-coding/python-sql-format",
      "title": "SQL 문을 f-string/format/% 로 만들고 있습니다(SQL 인젝션 위험).",
      "message": "SQL 문을 f-string/format/% 로 만들고 있습니다(SQL 인젝션 위험). cursor.execute(sql, params)처럼 값을 따로 넘기세요.",
      "severity": "critical",
      "location": {
        "file": "api/app.py",
        "start_line": 3,
        "end_line": 3
      },
      "package": null,
      "evidence": {
        "snippet": "    cur.execute(f\"SELECT * FROM t WHERE id={uid}\")",
        "context": {
          "start_line": 1,
          "lines": [
            "import subprocess, requests",
            "def f(cur, uid):",
            "    cur.execute(f\"SELECT * FROM t WHERE id={uid}\")",
            "    subprocess.run(\"ls \" + uid, shell=True)",
            "    requests.get(\"https://x\", verify=False)",
            "app.run(debug=True)"
          ]
        }
      },
      "cwe": [
        "CWE-89"
      ],
      "aliases": [],
      "references": [],
      "published": null,
      "flags": [],
      "remediation": {
        "kind": "code_change",
        "target_version": null,
        "autofix": null
      },
      "change": "persisting",
      "first_seen": "2026-10-30T14:20:49Z",
      "status": "code_issue",
      "status_label": "코드에서 문제 확인"
    },
    {
      "fingerprint": "semgrep:39703a067850ba5ad6d219f8",
      "tool": "semgrep",
      "category": "code",
      "rule_id": "vibe-coding/dom-innerhtml-dynamic",
      "title": "innerHTML/outerHTML에 고정 문자열이 아닌 값을 넣고 있습니다.",
      "message": "innerHTML/outerHTML에 고정 문자열이 아닌 값을 넣고 있습니다. 값에 <script>나 이벤트 속성이 들어가면 방문자 브라우저에서 실행됩니다(XSS). 글자만 넣을 땐 textContent를, HTML이 꼭 필요하면 DOMPurify로 정리한 뒤 넣으세요.",
      "severity": "medium",
      "location": {
        "file": "app/new.js",
        "start_line": 1,
        "end_line": 1
      },
      "package": null,
      "evidence": {
        "snippet": "document.body.innerHTML = window.name;",
        "context": {
          "start_line": 1,
          "lines": [
            "document.body.innerHTML = window.name;"
          ]
        }
      },
      "cwe": [
        "CWE-79"
      ],
      "aliases": [],
      "references": [],
      "published": null,
      "flags": [],
      "remediation": {
        "kind": "code_change",
        "target_version": null,
        "autofix": null
      },
      "change": "new",
      "first_seen": "2026-10-30T14:21:04Z",
      "status": "code_issue",
      "status_label": "코드에서 문제 확인"
    },
    {
      "fingerprint": "semgrep:888598edb9b3bbf8b745837e",
      "tool": "semgrep",
      "category": "code",
      "rule_id": "vibe-coding/sql-string-concat",
      "title": "SQL 문을 문자열 이어붙이기로 만들고 있습니다.",
      "message": "SQL 문을 문자열 이어붙이기로 만들고 있습니다. 입력값에 따옴표를 넣으면 DB를 마음대로 조회·삭제할 수 있습니다(SQL 인젝션). 자리표시자(?, $1)와 값 배열을 따로 넘기세요.",
      "severity": "critical",
      "location": {
        "file": "api/server.js",
        "start_line": 6,
        "end_line": 6
      },
      "package": null,
      "evidence": {
        "snippet": "  db.query(\"SELECT * FROM users WHERE id = \" + req.query.id);",
        "context": {
          "start_line": 3,
          "lines": [
            "const { exec } = require('child_process');",
            "app.use(cors({ origin: \"*\" }));",
            "app.get('/u', (req, res) => {",
            "  db.query(\"SELECT * FROM users WHERE id = \" + req.query.id);",
            "  db.query(`SELECT * FROM users WHERE name = '${req.query.name}'`);",
            "  exec(\"ls \" + req.query.dir);",
            "  const t = jwt.sign({ id: 1 }, \"mysecret\");"
          ]
        }
      },
      "cwe": [
        "CWE-89"
      ],
      "aliases": [],
      "references": [],
      "published": null,
      "flags": [],
      "remediation": {
        "kind": "code_change",
        "target_version": null,
        "autofix": null
      },
      "change": "resolved",
      "first_seen": "2026-10-30T14:20:49Z",
      "status": "code_resolved",
      "status_label": "코드에서 해결 확인",
      "resolved_at": "2026-10-30T14:21:04Z"
    },
    {
      "fingerprint": "gitleaks:28ce8dc7ac0880d3861d939b",
      "tool": "gitleaks",
      "category": "secret",
      "rule_id": "stripe-access-token",
      "title": "코드에 비밀값 노출: stripe-access-token",
      "message": "Found a Stripe Access Token, posing a risk to payment processing services and sensitive financial data.",
      "severity": "critical",
      "location": {
        "file": "api/config.js",
        "start_line": 1,
        "end_line": 1
      },
      "package": null,
      "evidence": {
        "snippet": "const stripeKey = \"sk_l********\";",
        "context": {
          "start_line": 1,
          "lines": [
            "const stripeKey = \"sk_l********\";",
            "const awsKey = \"AKIA********\";",
            "export default {stripeKey, awsKey};"
          ]
        },
        "masked_secret": "sk_l********",
        "entropy": 4.75
      },
      "cwe": [
        "CWE-798"
      ],
      "aliases": [],
      "references": [],
      "published": null,
      "flags": [
        "rotate_secret",
        "file_removed"
      ],
      "remediation": {
        "kind": "rotate_secret",
        "target_version": null,
        "autofix": null
      },
      "change": "resolved",
      "first_seen": "2026-10-30T14:20:49Z",
      "status": "runtime_check_needed",
      "status_label": "운영 환경 확인 필요",
      "resolved_at": "2026-10-30T14:21:04Z"
    },
    {
      "fingerprint": "osv:b017b6589a850d3d6f498a3b",
      "tool": "osv",
      "category": "dependency",
      "rule_id": "CVE-2021-23337",
      "title": "lodash 4.17.15: Command Injection in lodash",
      "message": "lodash versions prior to 4.17.21 are vulnerable to Command Injection via the template function.",
      "severity": "high",
      "location": {
        "file": "package-lock.json",
        "start_line": null,
        "end_line": null
      },
      "package": {
        "name": "lodash",
        "version": "4.17.15",
        "ecosystem": "npm",
        "fixed_versions": [
          "4.17.21"
        ]
      },
      "evidence": {
        "snippet": "lodash@4.17.15",
        "context": null
      },
      "cwe": [
        "CWE-77",
        "CWE-94"
      ],
      "aliases": [
        "CVE-2021-23337",
        "GHSA-35jh-r3h4-6jhm"
      ],
      "references": [
        "https://nvd.nist.gov/vuln/detail/CVE-2021-23337"
      ],
      "published": "2021-05-06T16:05:51Z",
      "flags": [],
      "remediation": {
        "kind": "upgrade_dependency",
        "target_version": "4.17.21",
        "autofix": null
      },
      "change": "resolved",
      "first_seen": "2026-10-30T14:20:49Z",
      "status": "code_resolved",
      "status_label": "코드에서 해결 확인",
      "resolved_at": "2026-10-30T14:21:04Z"
    }
  ]
}